{"authority_sha256":"0bbcc9c68a02cb93bab9f84b5afba61bfbcfb5c2a47ba9b6c7c7c7063518d208","ceremony_status":"not_performed","closure_ref":{"byte_count":807,"media_type":"application/json","relative_path":"inputs/roster-sources/closure.json","role":"roster_closure","sha256":"a887370640d2c6e9514e350c476e786d1040e6bcf3799422dee6c60b70944209"},"eligible_confirmation_ref":null,"input_lock_sha256":"7bb584da29f1fb55e5f46133a985bd3c249f154643dad5a3469ae737aee497e7","isolation_ref":{"byte_count":25856,"media_type":"application/json","relative_path":"inputs/roster-sources/isolation-receipt.json","role":"roster_isolation","sha256":"599527e896e9f48a53252585d02e98fd725074e8faa503ab7ce017cf1997b284"},"power_selection_status":"pending_c120_c160_validation","record_kind":"cloud_official_roster_candidate","schema_version":"0.1.0","selection_refs":[{"byte_count":146567,"media_type":"application/json","relative_path":"inputs/roster-sources/swe-selection.json","role":"roster_swe","sha256":"e6b4a052426f234daf7f1473d91ae3a861bd1dc5e270160936f4bc6015574071"},{"byte_count":23524,"media_type":"application/json","relative_path":"inputs/roster-sources/tau2-selection.json","role":"roster_tau","sha256":"a6c3e8fc16becbd87ad468f6cd8d3279ae76ac049f15ab804146dcfa1f80a12e"}],"status":"candidate_prelaunch","study_id":"neurips-2026-resampling-null","synthetic_authority":false}
